{
  "schemaId":"https://codeflow.local/schemas/rflsc.analyzer-result.v2.schema.json",
  "schemaVersion":2,
  "requestId":"req-1",
  "operation":"slice",
  "adapterVersion":"go-0.2.0",
  "analyzerRevision":"go-structural/0.2.0",
  "workspaceEpoch":7,
  "computedBasisId":"basis-1",
  "snapshotId":"snap-1",
  "snapshotTreeDigest":"tree-1",
  "dependencyFingerprint":"dep-1",
  "analysisReadSet":{
    "schemaId":"https://codeflow.local/schemas/rflsc.analysis-read-set.v2.schema.json",
    "schemaVersion":2,"readSetId":"rs-1","computedBasisId":"basis-1","workspaceEpoch":7,
    "documents":[{"path":"lib/main.go","documentRevisionId":"rev-1","contentId":"aaaaaaaaaaaaaaaaaaaaaaaaaaaaaaaaaaaaaaaaaaaaaaaaaaaaaaaaaaaaaaaa","contentHash":"aaaaaaaaaaaaaaaaaaaaaaaaaaaaaaaaaaaaaaaaaaaaaaaaaaaaaaaaaaaaaaaa","documentVersion":1,"byteLength":14}],
    "negativeObservations":[{"kind":"negative_lookup","path":"lib/missing.go","measured":true}],
    "membershipObservations":[{"kind":"membership","path":"lib","measured":true}],
    "dependencyFrontiers":[{"kind":"dependency_frontier","path":"go.mod","measured":true}]
  },
  "causalObservationClosure":{
    "schemaId":"https://codeflow.local/schemas/rflsc.observation-closure.v2.schema.json",
    "schemaVersion":2,"closureId":"closure-1","analysisReadSetId":"rs-1","computedBasisId":"basis-1","workspaceEpoch":7,"closureStatus":"closed",
    "negativeObservations":[{"kind":"negative_lookup","path":"lib/missing.go","measured":true}],
    "membershipObservations":[{"kind":"membership","path":"lib","measured":true}],
    "dependencyFrontiers":[{"kind":"dependency_frontier","path":"go.mod","measured":true}],
    "requiredObservations":["negative_lookup","membership","dependency_frontier"],"measuredObservations":["negative_lookup","membership","dependency_frontier"]
  },
  "capabilityProfile":{"adapter":"go","adapterVersion":"go-0.2.0","analyzerRevision":"go-structural/0.2.0","features":["snapshot_bytes","read_set","membership","negative_lookup","dependency_frontier"]},
  "coverage":{"includedSourceRoots":["lib"],"measured":true},
  "facts":[{"factId":"fact-1","kind":"symbol","symbolPath":"main.go#Run","evidenceRefs":["ev-1"]}],
  "diagnostics":[],
  "payload":{
    "candidateId":"cand-fixture0001",
    "language":"go",
    "entrySymbolPath":"main.go#Run",
    "steps":[{"ordinal":1,"kind":"call","description":"Run","symbolPath":"Run","anchor":{"repoRelativePath":"lib/main.go","byteRange":[0,1],"fileHash":"0000000000000000000000000000000000000000000000000000000000000000","spanHash":"0000000000000000000000000000000000000000000000000000000000000000","enclosingSymbolPath":"Run","canonicalAstFingerprint":"0000000000000000000000000000000000000000000000000000000000000000"}}],
    "edges":[],"truncated":false,"visitedCycleDetected":false,"redactedCount":0
  }
}
